{
  "name": "Criminal",
  "description": "You are an experienced criminal with a history of breaking the law. You have spent a lot of time among other criminals and still have contacts within the criminal underworld.",
  "edition": "2024",
  "status": "active",
  "ability_score_increase": {
    "total": 3,
    "options": [
      "Dexterity",
      "Constitution",
      "Intelligence"
    ],
    "suggested": {
      "Dexterity": 2,
      "Constitution": 1
    }
  },
  "effects": [
    {
      "type": "grant_skill_proficiency",
      "skills": [
        "Sleight of Hand",
        "Stealth"
      ]
    },
    {
      "type": "grant_origin_feat",
      "feat": "Alert"
    },
    {
      "type": "grant_tool_proficiency",
      "tools": [
        "Thieves' Tools"
      ]
    }
  ],
  "starting_equipment": {
    "option_a": {
      "items": [
        "Crowbar",
        "Thieves' Tools",
        "Traveler's Clothes"
      ],
      "gold": 16
    },
    "option_b": {
      "gold": 50
    }
  }
}
