{
  "name": "Sailor",
  "description": "You lived as a seafarer, wind at your back and decks swaying beneath your feet. You've perched on barstools in more ports of call than you can remember, faced mighty storms, and swapped stories with folk who live beneath the waves.",
  "edition": "2024",
  "status": "active",
  "ability_score_increase": {
    "total": 3,
    "options": [
      "Strength",
      "Dexterity",
      "Wisdom"
    ],
    "suggested": {
      "Strength": 1,
      "Dexterity": 2
    }
  },
  "effects": [
    {
      "type": "grant_skill_proficiency",
      "skills": [
        "Acrobatics",
        "Perception"
      ]
    },
    {
      "type": "grant_origin_feat",
      "feat": "Tavern Brawler"
    },
    {
      "type": "grant_tool_proficiency",
      "tools": [
        "Navigator's Tools"
      ]
    }
  ],
  "starting_equipment": {
    "option_a": {
      "items": [
        "Dagger",
        "Navigator's Tools",
        "Rope",
        "Traveler's Clothes"
      ],
      "gold": 20
    },
    "option_b": {
      "gold": 50
    }
  }
}
